{
  "typeName": "Query",
  "fieldName": "getPost",
  "dataSourceName": "MyDynamoDBDataSource",
  "resolverArn": "arn:aws:appsync:us-east-1:123456789012:apis/abc123/types/Query/resolvers/getPost",
  "requestMappingTemplate": "{\"version\":\"2018-05-29\",\"operation\":\"GetItem\"}",
  "responseMappingTemplate": "$util.toJson($ctx.result)",
  "kind": "UNIT",
  "pipelineConfig": "example-string",
  "syncConfig": "example-string",
  "cachingConfig": "example-string",
  "maxBatchSize": 0,
  "runtime": "example-string",
  "code": ""
}